auditor,auditReportPageRange,link,page_text,normal
None,3 - 122,https://www1.hkexnews.hk/listedco/listconews/gem/2020/0517/2020051700057.pdf,"121NOTES TO THE CONSOLIDATED FINANCIAL STATEMENTS20 TRADE AND OTHER RECEIVABLES, DEPOSITS AND PREPAYMENTS (CONTINUED)whose selling activities resulted in enrolment of adult language courses in Australia which are still not completed at the end of the reporting period. Such commissions capitalised included in other receivables and prepayments Contract costs are recognised as part of ﬁadvertising and promotion expensesﬂ in the consolidated statement of profit or loss and other comprehensive income in the period in which revenue from provision of language courses Trade receivables from the third parties mainly represent tuition fees receivables from students and receivables from financial institutions in relation to the payments settled through credit cards by customers of which the settlement period is normally one to two months from transaction date.The following is an ageing analysis of trade receivables from the third parties net of allowance for doubtful debts  2019  HK$™000 2,914 1,018 399 151  4,482 was past due at the end of the reporting period.",True
None,3 - 193,https://www1.hkexnews.hk/listedco/listconews/sehk/2020/0517/2020051700031.pdf,"19246. FINANCIAL RISK MANAGEMENT OBJECTIVES AND POLICIES (continued)Interest rate risk (continued)The following table demonstrates the sensitivity at the end of the reporting period to a reasonably possible change in interest rates of the major currencies in which the Group™s borrowings are denominated, with all other variables held constant, of the Group™s profit before income tax (through the impact on floating rate borrowings). The Group™s equity is not affected, except for the consequential effect on retained profits (a component of the Group™s equity) by the changes in profit before income tax.20192018Impact on profit before income taxImpact on profit before income tax   Changes in variables Œ RMB interest rate+ 50 basis points(6,690)(8,849)- 50 basis points6,6908,849  Changes in variables Œ GBP interest rate+ 50 basis pointsŒ(2,751)- 50 basis pointsŒ2,751  Foreign currency riskMost of the Group™s operating entities operate in Mainland China with most of the transactions denominated in Renminbi. The Group is exposed to foreign exchange risk with only limited exposure arising primarily with respect to cash at banks and bank borrowings, which are mainly denominated in US$, HK$, GBP and AUD.Renminbi is not a freely convertible currency. The conversion of Renminbi into foreign currencies is subject to the rules and regulations of the foreign exchange control promulgated by the PRC government.The following table demonstrates the sensitivity at the end of the reporting period to a reasonably possible change in the US$, the HK$, the GBP and the AUD exchange rates, with all other variables held constant, of the Group™s profit before income tax (due to changes in the fair value of monetary assets and liabilities). The Group™s equity is not affected, except for the consequential effect on retained profits (a component of the Group™s equity) by the impact on profit before income tax as disclosed below.",True
None,5 - 93,https://www1.hkexnews.hk/listedco/listconews/gem/2020/0517/2020051700025.pdf,"93ANNUAL REPORT 2019˛˚˝˙ˆ˝˚˝˙˝˙ˆ˝For the year ended 31 December 201936. FINANCIAL RISK MANAGEMENT OBJECTIVES AND POLICIES (Continued)36.2 Credit risk (Continued)Impairment and provisioning policiesThe Group™s policy requires the review of individual outstanding amounts at least monthly or more regularly depending on individual circumstances or market condition.The impairment requirements under HKFRS 9 are based on an expected credit loss model. The Group applies simpli˜ed approach to measure ECLs on trade receivables from cash clients and clearing house; and general approach to measure ECLs on trade receivables from margin loans receivables, loans and interest receivables, cash and cash equivalents, trust bank balances held on behalf of client and other ˜nancial assets accounted for at amortised cost. Under the simpli˜ed approach, the Group measures the loss allowance at an amount equal to lifetime ECLs. Under the general approach, ˜nancial assets migrate through the following three stages based on the change in credit risk since initial recognition: Stage 1: 12-months ECLs, Stage 2: Lifetime ECLs Š not credit-impaired and Stage 3: Lifetime ECLs Š credit-impaired.Assessment of signi˜cant increase in credit riskWhen determining whether the risk of default has increased significantly since initial recognition, the Group considers both quantitative and qualitative information and analysis based on the Group™s historical experience and internal credit risk assessment, including forward-looking information. The loan and advances use the number of days past due and loan-to-collateral value or loan-to-credit enhancement value to determine significant increase in credit risk. Credit risk is deemed to have increased signi˜cantly if there is a signi˜cant deterioration of the above factors at the reporting date relative to that at the date of initial recognition.Calculation of ECLsThe ECLs are assessed by the Group on regular basis. Based on the aforesaid factors, margin loan receivables and loan and interest receivables are classi˜ed into 3 stages.ECLs for margin receivables, loan and interest receivables under stage 1 is calculated on collective basis. Form margin loan receivables and loan and interest receivables under stage 2 and stage 3, the lifetime ECLs is calculated.The ECLs of non-standard ˜nancing Group has pre-de˜ned loss rate reference to the default rate for from external rating agencies.If there is material decrease in collaterals and credit enhancement values and the full recovery of the loan is in doubt, the loan will be classi˜ed into stage 3. For the loans classi˜ed as stage 3, the Group may further calculate the ECL based on probability-weighted scenarios to measure the expected credit loss. Each scenario is associated with different exposure at default and probability.",True
None,4 - 199,https://www1.hkexnews.hk/listedco/listconews/sehk/2020/0515/2020051501473.pdf,"199De˜nitionsﬁBoardﬂthe board of Directors of the CompanyﬁCompanyﬂTa Yang Group Holdings Limited, a company incorporated in the Cayman Islands with limited liability, whose Shares are listed on the Main Board of the Stock Exchangeﬁconnected person(s)ﬂ;  ﬁpercentage ratio(s)ﬂ and  ﬁsubsidiary(ies)ﬂeach has the meaning ascribed to it under the Listing Rules ﬁDirectorsﬂthe directors of the CompanyﬁGroupﬂthe Company and its subsidiariesﬁHK$ﬂHong Kong dollars, the lawful currency of Hong KongﬁHong KongﬂHong Kong Special Administrative Region of the PRCﬁLatest Practicable Dateﬂ7 November 2018, being the latest practicable date prior to the dispatch of this report for the purpose of ascertaining certain information contained hereinﬁListing Rulesﬂthe Rules Governing the Listing of Securities on the Stock ExchangeﬁPRCﬂthe People™s Republic of China (for the purpose of this report, excluding Hong Kong, Macau Special Administrative Region and Taiwan)ﬁRMBﬂ, ﬁRenminbiﬂRenminbi, the lawful currency of the PRCﬁSFOﬂthe Securities and Futures Ordinance (Chapter 571 of the Laws of Hong Kong), as amended or supplemented from time to time571ﬁShareholder(s)ﬂholder(s) of the SharesﬁSharesﬂordinary shares of HK$0.10 each in the share capital of the Company0.10",True
None,4 - 182,https://www1.hkexnews.hk/listedco/listconews/sehk/2020/0515/2020051501291.pdf,"Annual Report 2019Zhengye International Holdings Company Limited179For the year ended 31 December 2019Notes to the Consolidated Financial Statements47. (a) 80%(b) 47. EVENTS AFTER THE REPORTING PERIOD(a) AcquisitionSubsequent to 31 December 2019, the Group completed its negotiations with Jiangxi Shengjing Technology Company Limited and entered in an agreement for the acquisition of 80% of equity interest in Yudu County Zhengyi Paper Products and Paper Industry Company Limited at 3 January 2020. The transaction was completed on 1 March 2020. Details of the acquisition are set out in the Group™s circular dated 3 January 2020.(b) The outbreak of coronavirus disease (ﬁthe COVID-19ﬂ)The outbreak of COVID-19 and the subsequent quarantine measures as well as the travel restrictions imposed by many countries have had a severe negative impact on the operations of the Group, as most of the Group™s operations are located in Mainland China. One of the subsidiary of the Group is in Wuhan City. The Group had to stop its manufacturing activities since late January 2020 due to mandatory government quarantine measures in an effort to contain the spread of the epidemic.Even though the Group had resumed its manufacturing activities since February and March except for the subsidiary in Wuhan City, which is remain suspended until April. They are still not operating at normal capacity.In addition, the operations of certain of the Group™s customers, suppliers are also located in Wuhan or other cities in Mainland China, the outbreak of COVID-19 is expected to have negative effect to these counterparties in different aspects, which in turn, may affect the recoverability of Group™s trade receivables and other financial assets that are subject to ECL assessment.The Directors of the Company will continue to closely monitor the development of the epidemic and work to mitigate the adverse effects, and will adopt various measures to make up for the production shortfall. As the situation remains fluid at the date these financial statements are authorized for issue, the directors of the Company considered that the financial effects of the COVID-19 on the Group™s consolidated financial statements cannot be reasonably estimated. Nevertheless, the COVID-19 outbreak is expected to affect the consolidated results for the first half and full year of 2020.",True
None,79 - 82,https://www1.hkexnews.hk/listedco/listconews/sehk/2020/0515/2020051501158.pdf,"81VI. AUDITOR™S RESPONSIBILITIES FOR THE AUDIT OF THE FINANCIAL STATEMENTSOur objectives are to obtain reasonable assurance about whether the financial statements as a whole are free from material misstatement, whether due to fraud or error, and to issue an auditor™s report that includes our opinion. Reasonable assurance is a high level of assurance, but it is not a guarantee that an audit conducted in accordance with China Standards on Auditing will always detect a material misstatement when it exists. Misstatements can arise from fraud or error and are considered material if, individually or in the aggregate, they could reasonably be expected to influence the economic decisions of users taken on the basis of the financial statements.As part of an audit in accordance with China Standards on Auditing, we exercise professional judgment and maintain professional scepticism throughout the audit. We also:(1) Identify and assess the risks of material misstatement of the financial statements, whether due to fraud or error, design and perform audit procedures responsive to those risks, and obtain audit evidence that is sufficient and appropriate to provide a basis for our opinion. The risk of not detecting a material misstatement resulting from fraud is higher than for one resulting from error, as fraud may involve collusion, forgery, intentional omissions, misrepresentations, or the override of internal control.(2) Obtain an understanding of internal control relevant to the audit in order to design audit procedures that are appropriate in the circumstances.(3) Evaluate the appropriateness of accounting policies used and the reasonableness of accounting estimates and related disclosures made by the management.(4) Conclude on the appropriateness of the management™s use of the going concern basis of accounting and, based on the audit evidence obtained, whether a material uncertainty exists related to events or conditions that may cast significant doubt on Hisense Appliances™s ability to continue as a going concern. If we conclude that a material uncertainty exists, we are required to draw attention in our auditor™s report to the related disclosures in the financial statements or, if such disclosures are inadequate, to modify our opinion. Our conclusions are based on the audit evidence obtained up to the date of our auditor™s report. However, future events or conditions may cause the Hisense Appliances to cease to continue as a going concern.(5) Evaluate the overall presentation, structure and content of the financial statements, including the disclosures, and whether the financial statements represent the underlying transactions and events in a manner that achieves fair presentation.(6) Obtain sufficient appropriate audit evidence regarding the financial information of the entities or business activities within Hisense Appliances to express an opinion on the consolidated financial statements. We are responsible for the direction, supervision and performance of the group audit. We remain solely responsible for our audit opinion.We communicate with those charged with governance regarding, among other matters, the planned scope and timing of the audit and significant audit findings, including any significant deficiencies in internal control that we identify during our audit.We also provide those charged with governance with a statement that we have complied with relevant ethical requirements regarding independence, and to communicate with them all relationships and other matters that may reasonably be thought to bear on our independence, and where applicable, related safeguards.From the matters communicated with those charged with governance, we determine those matters that were of most significance in the audit of the financial statements of the current period and are therefore the key audit matters. We describe these matters in our auditor™s report unless law or regulation precludes public disclosure about the matter or when, in extremely rare circumstances, we determine that a matter should not be communicated in our report because the adverse consequences of doing so would reasonably be expected to outweigh the public interest benefits of such communication.",True
None,5 - 156,https://www1.hkexnews.hk/listedco/listconews/sehk/2020/0515/2020051500063.pdf,"(Expressed in RMB™000 unless otherwise indicated)156FUSEN PHARMACEUTICAL COMPANY LIMITED  Annual Report 2019Notes to the Consolidated Financial Statements (Continued)36 POSSIBLE IMPACT OF AMENDMENTS, NEW STANDARDS AND INTERPRETATIONS ISSUED BUT NOT YET EFFECTIVE FOR THE YEAR ENDED 31 DECEMBER 2019Up to the date of issue of these financial statements, the IASB has issued a number of amendments and a new standard, IFRS 17, Insurance contracts, which are not yet effective for the year ended 31 December 2019 and which have not been adopted in these financial statements. These developments include the following which may be relevant to the Group.Effective for years beginning on or afterAmendments to IFRS 3, Definition of a business1 January 2020Amendments to IAS 1 and IAS 8, Definition of material1 January 2020The Group is in the process of making an assessment of what the impact of these developments is expected to be in the period of initial application. So far it has concluded that the adoption of them is unlikely to have a significant impact on the consolidated financial statements.37 NON-ADJUSTING EVENTS AFTER THE REPORTING PERIOD(a) Proposed dividendAfter the statement of financial position date, the Board of Directors proposed a final dividend for 2019. For detail, please refer to Note 12.(b) Outbreak of novel coronavirusSince the outbreak of novel coronavirus in January 2020, the prevention and control of the novel coronavirus has been going on throughout the country. The novel coronavirus has brought additional uncertainties for the Group.Up to the date of this report, the Group considers that the novel coronavirus has yet to cause any adverse effect at this stage. The Board will continue to assess the impact of the novel coronavirus on the Group™s operations and financial performance and closely monitor the Group™s exposures to the risks and uncertainties in connection with the novel coronavirus. The Group will take appropriate measures as necessary. Up to the date of these financial statements, the assessment is still in progress.38 APPROVAL OF FINANCIAL STATEMENTSThe financial statements were approved by the Board of Directors on 6 May 2020.",True
None,3 - 125,https://www1.hkexnews.hk/listedco/listconews/sehk/2020/0515/2020051500055.pdf,"125Kimou Environmental Holding Limited˜˜Annual Report 2019(Expressed in Renminbi unless otherwise indicated)NOTES TO THE FINANCIAL STATEMENTS33 NON-ADJUSTING EVENTS AFTER THE REPORTING PERIOD(a) Subsequent to the end of the reporting period, the Group has obtained additional guarantee from the Ultimate Shareholders for certain bank loans. Further details are disclosed in note 25(iv).(b) The coronavirus outbreak since early 2020 has brought about additional uncertainties in the Group™s operating environment and has impacted the Group™s operations and financial position. The Group has been closely monitoring the impact of the developments on the Group™s businesses and has put in place contingency measures. These contingency measures include but not limited continuously monitoring the operations of our customers and strengthening cost control and assessing our suppliers™ readiness. The Group will keep its contingency measures under review as the situation devolves.The Directors have assessed that the outbreak may have the following possible impacts on the Group:Š The temporary economic slowdown resulting from the outbreak may lead to a reduction in the operating performance of part of the Group™s customers which might indirectly affect the Group™s financial performance.Š The assessment of the recoverable amounts of the Group™s certain property, plant and equipment, construction in progress, investment property, right-of-use assets and intangible assets is based on the conditions as at 31 December 2019. The outbreak and its impact on the recoverable amounts of the related assets (if any) will be considered in the impairment test to be performed in 2020.Š In determining the carrying amounts of deferred tax assets of certain entities within the Group, expected taxable profits are estimated based on the operating environment of the Group as at 31 December 2019. The outbreak and its impact on the Group™s performance may affect the carrying amounts of such deferred tax assets to be recognised and hence the net profit in 2020.Š The Group might have to experience longer turnover time for recovering its trade receivables which may increase the associated credit risks.Š Completion progress of the certain construction projects of the Group may be delayed resulting from the outbreak.As the extent to which the coronavirus outbreak will continue is uncertain, it is not practicable to estimate the full financial effect that the coronavirus outbreak may have on the Group™s businesses as at the date when the financial statements are authorised to issue.",True
None,20 - 220,https://www1.hkexnews.hk/listedco/listconews/sehk/2020/0515/2020051500001.pdf,"FOREBASE INTERNATIONAL HOLDINGS LIMITED220Notes to the Consolidated Financial StatementsFor the year ended 31 December 201942. FINANCIAL RISK MANAGEMENT AND FAIR VALUE MEASUREMENTS (Continued)42.5 Liquidity riskThe Group™s policy is to regularly monitor its liquidity requirements to ensure that it maintains sufficient reserve of cash and adequate committed lines of funding from major financial institutions to meet its liquidity requirements in the short and longer term.After the banking facilities letter of the secured loans have been renewed in September 2019, the secured loans are subject to the relevant bank™s overriding right to demand for repayment even though the scheduled repayment dates are twelve months after the end of the reporting period. As a result, these loans with scheduled repayment dates beyond one year amounted to HK$34,275,000 had to be classified as current liabilities as at 31 December 2019.The following table show the details of the remaining contractual maturities as at 31 December 2019 and the Group™s non-derivative liabilities and derivative liabilities which are based on contractual undiscounted cash ˚ows (including interest payments computed using contractual rates or, if ˚oating, based on rates current as at the end of each reporting period) and the earliest date the Group can be required to pay.For the purpose of the below analysis, the secured loans are included within current liabilities and analysed as on demand or within one year.42.  42.5 34,275,000",True
None,54 - 60,https://www1.hkexnews.hk/listedco/listconews/sehk/2020/0514/2020051402189.pdf,"60From the matters we had discussed with the governing bodies, we confirmed which matters were the most important to the audit of the financial statements for the current period and thus constituted the key audit matters. We set out these matters in the auditors™ report. Unless the disclosure of these matters are forbidden by the laws and regulations, or, in rare cases, if it is reasonably expected that the negative impacts caused by discussing certain matters in the auditors™ report would be larger than the benefits for public interest, we shall not disclose the matters in the auditors™ report under such circumstances.Pan-China Certified Public  Accountants LLPCertified Public Accountant:  (Project Partner)Certified Public Accountant:Hangzhou, the People™s Republic of China27th April, 2020",True
None,3 - 128,https://www1.hkexnews.hk/listedco/listconews/sehk/2020/0514/2020051401923.pdf,"Five Year Financial Summary 128Momentum Financial Holdings Limited  Annual Report 2019A summary of the results and of the assets and liabilities of the Group for the last five financial years, as extracted from the published audited financial statements and restated/reclassified as appropriate, is set out below.RESULTSYear ended 31 December20192018201720162015HK$™000HK$™000HK$™000HK$™000HK$™000Revenue 299,525137,64777,15061,742130,796Cost of sales (281,665)(130,451)(70,252)(50,436)(112,979)      Gross profit 17,8607,1966,89811,30617,817Other operating income 7989118,5184,585732Gain/(loss) on disposal of a subsidiary (931)Œ19,674ŒŒGain on early redemption of  convertible bonds ŒŒŒŒ4,992Change in fair value of financial assets  at FVTPL/held-for-trading investment (159)(479)(3,249)2,924(11,252)Selling and distribution expenses (1,450)(467)(609)(2,611)(2,532)Administrative and other expenses (27,592)(21,805)(25,945)(43,739)(57,732)Finance costs (8,578)(6,878)(16,123)(14,836)(27,692)      Loss before taxation (20,052)(21,522)(10,836)(42,371)(75,667)Income tax (expense) credit 1,354(486)(72)(573)(1,743)      Loss for the year (18,698)(22,008)(10,908)(42,944)(77,410)Items that may be reclassified  subsequently to profit or loss:  Exchange differences arising on   translation of foreign operations   and total other comprehensive   income (expense)(1,379)(3,473)6,109(7,189)(7,034) Release of exchange reserve upon   disposals of subsidiaries1,550ŒŒŒŒ Release of revaluation reserve upon   disposal of available-for-sale   investment ŒŒŒ(330)Œ      Total comprehensive (expense)  income for the year (18,527)(25,481)(4,799)(50,463)(84,444)      Loss per share (HK cents)  Basic and diluted (1.90)(2.24)(1.11)(4.37)(8.00)      ASSETS AND LIABILITIESYear ended 31 December20192018201720162015HK$™000HK$™000HK$™000HK$™000HK$™000TOTAL ASSETS253,168160,511159,143277,914359,824TOTAL LIABILITIES(200,982)(93,009)(66,160)(180,132)(211,579)      NET ASSETS52,18667,50292,98397,782148,245      ",True
