auditor,auditReportPageRange,link,page_text,normal
None,7 - 384,https://www1.hkexnews.hk/listedco/listconews/sehk/2020/0415/2020041501297.pdf,"382  Documents for InspectionFinancial statements signed and sealed by the legal representative, the person-in-charge of accounting and the head of the accounting firmDocuments for InspectionThe original auditor™s report sealed with the corporate seal of the accounting firm and signed and sealed by the certified public accountantDocuments for InspectionOriginals of all documents and announcements of the Company publicly disclosed in the newspapers designated by the CSRC during the Reporting PeriodDocuments for Inspection2019 Annual Report and 2019 Annual Results Announcement published on the Hong Kong Stock Exchange  Chairman: Guo WenqingDate of Approval from the Board: 31 March 2020AMENDMENT ON INFORMATION Applicable˚ Not Applicable",True
None,5 - 299,https://www1.hkexnews.hk/listedco/listconews/sehk/2020/0415/2020041500894.pdf,"EVERBRIGHT SECURITIES COMPANY LIMITEDNOTES TO THE CONSOLIDATED FINANCIAL STATEMENTS (continued)For the year ended 31 December 2019(All amounts expressed in RMB thousand unless otherwise specified)16367.NON-ADJUSTING EVENTS AFTER THE REPORTING PERIOD (continued)(c)Redemption of corporate bonds after reporting period (continued)On 14 February 2017, the Company issued a corporate bond with an aggregate principal amount ofRMB2 billion through non-public offering, which has a term of 3 years and bears interest at a rate of4.45%. The redemption work of this bond was completed on 14 February 2020. The Company™sprincipal amount of the current bond was RMB2 billion, and the total interest paid was RMB89million.(d)Impact assessment on epidemic situation of COVID-19Since January 2020, the prevention and control of COVID-19 has been carried out effectivelynationwide. COVID-19 may affect the asset quality or income of the Company in the short term. theCompany effectively implements the requirements of the ﬁNotice on Further Strengthening FinancialSupport for Prevention and Control of New Coronavirus Infectious Pneumoniaﬂ issued by thePeople™s Bank of China, the Ministry of Finance, the China Banking and Insurance RegulatoryCommission, the China Securities Regulatory Commission and the State Administration of ForeignExchange, and strengthens the financial support and control for epidemic prevention. The Companywill continue to pay close attention to the development of the situation, evaluate and actively respondto its impact on the Company™s financial position and operating results.68.APPROVAL OF THE CONSOLIDATED FINANCIAL STATEMENTSThe financial statements were approved and authorised for issue by the Board of Directors on 27March 2020.",True
None,67 - 74,https://www1.hkexnews.hk/listedco/listconews/sehk/2020/0415/2020041500695.pdf,73Ł  Ł Ł   Ł Ł   2020327,True
None,3 - 324,https://www1.hkexnews.hk/listedco/listconews/sehk/2020/0415/2020041500543.pdf,"323IV. Information Disclosure and Site for InspectionDesignated publication newspaperShanghai Securities News, Securities Times, China Securities Journal, Securities Daily (for A Shares only)Designated publication websitehttp://www.sse.com.cnhttp://www.hkexnews.hkhttp://www.sz-expressway.comAnnual report available atPRC: Podium Levels 2Œ4, Jiangsu Building, Yitian Road, Futian District, ShenzhenHong Kong: Room 1603, 16/F, China Building, 29 Queen™s Road Central, Hong KongV. Security ProfileType of securitiesListing exchangeAbbreviationSecurity codeA ShareThe Shanghai Stock ExchangeShenzhen Expressway600548H ShareThe Stock Exchange of Hong Kong LimitedShenzhen Expressway00548BondThe Stock Exchange of Hong Kong LimitedSZEW B21075684VI. Other InformationAuditorErnst & Young Hua Ming LLPLevel 16, Ernst & Young Tower Oriental Plaza No. 1 East Chang An Avenue Dong Cheng District Beijing, ChinaSigning auditor: XIE Feng Eric, Liang ChangePRC legal adviserGuangdong Junyan Law FirmRoom C, 10th Floor, Block5 Dachong International Centre, Huarun, Shennan Street, Nanshan District, Shenzhen, ChinaHong Kong legal adviserLoong & Yeung, SolicitorsRoom 1603, 16/F, China Building, 29 Queen™s Road Central, Hong KongDomestic share registrar and transfer officeChina Securities Depository and Clearing Corporation Limited, Shanghai Branch36/F, China Insurance Building, 166 Lujiazui Road East, Pudong New District, ShanghaiShare registrar and transfer office in Hong KongHong Kong Registrars Limited46/F, Hopewell Centre, 183 Queen™s Road East, Hong KongInvestor relations consultant of A SharesEverbloom Investment Consultant Company LimitedRoom 3801Œ3803, Rongchao Trade Centre, 4028 Jintian Road, Futian District, ShenzhenInvestor relations consultant of H SharesWonderful Sky Financial Group6/F, Nexxus Building, No. 41 Connaught Road Central, Hong KongPrincipal banksChina Development BankIndustrial and Commercial Bank of ChinaChina Merchants Bank",True
None,4 - 72,https://www1.hkexnews.hk/listedco/listconews/sehk/2020/0414/2020041401683.pdf,"7234. EVENT AFTER REPORTING PERIODSubsequent to the end of the reporting period, there are certain updates on the Group™s proposed restructuring in progress including capital reorganisation which comprises the share consolidation, the authorised share capital cancellation and the authorised share capital increase, and further details of which are stated in note 2 to the consolidated financial statements.35. POSSIBLE IMPACT OF AMENDMENTS, NEW STANDARDS AND INTERPRETATIONS ISSUED BUT NOT YET EFFECTIVE FOR THE YEAR ENDED 31 DECEMBER 2019Up to the date of issue of these financial statements, the IASB has issued a number of amendments and a new standard, IFRS 17, Insurance contracts, which are not yet effective for the year ended 31 December 2019 and which have not been adopted in these financial statements. These developments include the following which may be relevant to the Group.Effective for accounting periods beginning on or afterAmendments to IFRS 3, Definition of a business1 January 2020Amendments to IAS 1 and IAS 8, Definition of material1 January 2020Amendments to IFRS 10 and IAS 28 Sales or contribution of assets between an  investor and its associate and joint ventureTo be determinedAmendments to IFRS 9, IAS 39 and IFRS 7, Interest rate benchmark reform1 January 2020New standard, IFRS 17 Insurance contracts1 January 2021* Effective for business combinations and asset acquisitions for which the acquisition date is on or after the beginning of the first annual period beginning on or after 1 January 2020The Group is in the process of making an assessment of what the impact of these developments is expected to be in the period of initial application. So far it has concluded that the adoption of them is unlikely to have a significant impact on the consolidated financial statements.",True
None,9 - 134,https://www1.hkexnews.hk/listedco/listconews/sehk/2020/0414/2020041400489.pdf,"Luks Group (Vietnam Holdings) Company LimitedAnnual Report 2019134Five Year Financial SummaryA summary of the results and of the assets, liabilities and non-controlling interests of the Group for the last five financial years, as extracted from the published audited financial statements, is set out below: Year ended 31 December 2019 2018 2017 2016 2015 HK$™000 HK$™000 HK$™000 HK$™000 HK$™000RESULTSPROFIT FOR THE YEAR 121,480 143,420 94,096 106,866 88,531Attributable to: Owners of the parent 122,280 144,128 94,417 111,974 89,580 Non-controlling interests (800) (708) (321) (5,108) (1,049) 121,480 143,420 94,096 106,866 88,531Assets, Liabilities and Non-Controlling Interests As at 31 December 2019 2018 2017 2016 2015 HK$™000 HK$™000 HK$™000 HK$™000 HK$™000TOTAL ASSETS 2,828,376 2,818,729 2,765,414 2,675,021 2,605,521TOTAL LIABILITIES (405,906) (448,077) (464,709)  (439,465) (409,045)NON-CONTROLLING INTERESTS 28,288 28,309 29,977 31,416 31,665 2,450,758 2,398,961 2,330,682 2,266,972 2,228,141",True
None,96 - 100,https://www1.hkexnews.hk/listedco/listconews/sehk/2020/0409/2020040900493.pdf,"100AUDITOR™S RESPONSIBILITIES FOR THE AUDIT OF THE FINANCIAL STATEMENTS (Continued)We communicate with Audit Committee regarding, among other matters, the planned scope and timing of the audit and significant audit findings, including any significant deficiencies in internal control that we identify during our audit.We also provide Audit Committee with a statement that we have complied with relevant ethical requirements regarding independence, and to communicate with them all relationships and other matters that may reasonably be thought to bear on our independence, and where applicable, related safeguards.From the matters communicated with Audit Committee, we determine those matters that were of most significance in the audit of the financial statements of the current period and are therefore the key audit matters. We describe these matters in our auditor™s report unless law or regulation precludes public disclosure about the matter or when, in extremely rare circumstances, we determine that a matter should not be communicated in our report because the adverse consequences of doing so would reasonably be expected to outweigh the public interest benefits of such communication.PricewaterhouseCoopers Zhong Tian LLPSigning CPA:  Chen Jing (Engagement Partner)Signing CPA:  Wang DoudouShanghai, the People™s Republic of China23 March 2020",True
None,29 - 276,https://www1.hkexnews.hk/listedco/listconews/sehk/2020/0409/2020040900348.pdf,"2792019 Annual Report SurveyAnnual Report is a key communication channel between shareholders and the Company. Last year, we received around 100 questionnaires of ﬁYour Views on Annual Report 2018ﬂ. Each of these responses benefited us in enhancing and further improving our annual reports. We are deeply indebted to the respondents for their constructive responses. In accordance with our commitment, we have to contribute HK$50 to a charitable organisation for each questionnaire received. In this regard, we have given a sum of HK$10,000 to the charitable organisation, WWF, in 2019. In addition, we have already implemented the suggestion of allowing shareholders to choose means of receipt and language of corporate communication to enhance environmental protection and cost savings.We value and are eager to keep hearing your comments on our annual report for our further improvement in the future. It is highly appreciated if you could spare your precious time to complete the questionnaire of ﬁYour Views on Annual Report 2019ﬂ, as attached in this annual report, and return it by post or fax to us at +852 2877 0988. You can also fill in the electronic form at our website, www.chinatelecom-h.com.Annual General MeetingTo be held at 11:00 a.m. on 26 May2020 inGrand Hyatt Hong Kong.Registered officeAddress:31 Jinrong StreetXicheng DistrictBeijingPRC 100033Tel:86 10 5850 1800Fax:86 10 6601 0728Any enquiries relating to the strategic development or operations of China Telecom Corporation Limited, please contact the Investor Relations Department:Investor Relations DepartmentTel:852 2877 9777IR Enquiry:852 2582 0388Fax:852 2877 0988Email:ir@chinatelecom-h.com",True
None,13 - 93,https://www1.hkexnews.hk/listedco/listconews/sehk/2020/0409/2020040900027.pdf,"9324. TRADE AND OTHER RECEIVABLES20192018RMB™000RMB™000Trade receivables86754Less: loss allowance for trade receivablesŒŒ   Trade receivables Š net86754Note receivables1,0001,000Prepayments for raw materials81,48787,459Other tax receivables11,11723,120Due from employees5,4191,977Others4,2048,597   104,094122,207   As at 31 December 2019 and 2018, the fair value of trade and other receivables of the Group approximated to their carrying amounts.The maximum exposure to credit risk at the reporting date is the carrying amount of each class of receivable mentioned above. The Group does not hold any collateral as security.The Group allows an average credit period of 0 to 90 days to its trade customers. The following is an aged analysis of trade receivables, net of allowance for trade receivables, presented based on the invoice date at the end of the reporting period.20192018RMB™000RMB™0000-90 days86754   Reconciliation of loss allowance for trade receivables:20192018RMB™000RMB™000At the beginning of the year, as previously statedŒ7,153Write off during the yearŒ(7,153)   At the end of the yearŒŒ   ",True
None,60 - 67,https://www1.hkexnews.hk/listedco/listconews/sehk/2020/0408/2020040800633.pdf,"67AUDITOR™S REPORTAUDITOR™S RESPONSIBILITIES FOR THE AUDIT OF THE FINANCIAL STATEMENTS (CONTINUED)From the matters communicated with audit committee, we determine those matters that were of most significance in the audit of the financial statements of the current period and are therefore the key audit matters. We describe these matters in our auditor™s report unless law or regulation precludes public disclosure about the matter or when, in extremely rare circumstances, we determine that a matter should not be communicated in our report because the adverse consequences of doing so would reasonably be expected to outweigh the public interest benefits of such communication.PricewaterhouseCoopers Zhong Tian LLPSigning CPA Zheng JiaYan(Engagement Partner)Shanghai, the People™s Republic of ChinaSigning CPA27 March 2020 Zhao XianDaPwC ZT Shen Zi (2020) No. 15006(Page 8 of 8)",True
None,6 - 316,https://www1.hkexnews.hk/listedco/listconews/sehk/2020/0408/2020040800279.pdf,"AIA.COMANNUAL REPORT 2019AIA GROUP LIMITED  ANNUAL REPORT 2019LEADINGwithPURPOSESTOCK CODE 1299Notes: (1) Hong Kong SAR refers to Hong Kong Special Administrative Region. (2) Macau SAR refers to Macau Special Administrative Region.(3) Explanations of certain terms and abbreviations used in this report are set forth in the Glossary.AIA Group Limited and its subsidiaries (collectively ﬁAIAﬂ  or the ﬁGroupﬂ) comprise the largest independent publicly listed pan-Asian life insurance group. It has a presence in  18 markets in Asia-Pacific Œ  wholly-owned branches and subsidiaries in Hong Kong SAR, Thailand, Singapore, Malaysia, Mainland China, South Korea, the Philippines, Australia, Indonesia, Taiwan (China), Vietnam, New Zealand,  Macau SAR, Brunei, Cambodia, Myanmar, a 99 per cent subsidiary in Sri Lanka, and  a 49 per cent joint venture  in India. The business that is now AIA was first established in Shanghai a century ago in 1919. It is a market leader in the Asia-Pacific region (ex-Japan) based on life insurance premiums and holds leading positions across the majority of its markets. It had total assets of US$284 billion as of 31 December 2019. AIA meets the long-term savings and protection needs of individuals by offering a range of products and services including life insurance, accident and health insurance and savings plans. The Group also provides employee benefits, credit life and pension services to corporate clients. Through an extensive network of agents, partners and employees across Asia-Pacific, AIA serves the holders of more than 36 million individual policies and over  16 million participating members of group insurance schemes.AIA Group Limited is listed on the Main Board of The Stock Exchange of Hong Kong Limited under the stock code ﬁ1299ﬂ with American Depositary Receipts (Level 1) traded on the over-the-counter market (ticker symbol: ﬁAAGIYﬂ).ABOUT AIAOur Vision is to be the world™s pre-eminent life insurance provider. VISION & PURPOSEOur Purpose is to play a leadership role in driving economic and social development across the region.",True
None,5 - 469,https://www1.hkexnews.hk/listedco/listconews/sehk/2020/0408/2020040800037.pdf,"10.ChangesinthecompositionoftheinvestmentportfoliofortheSub-FundsdistributedinHongKong(continued)XtrackersMSCIUSASWAPUCITSETF*(continued)DescriptionCurrency(local)Shares/Nominalasat31December2018PurchasesSalesShares/Nominalasat31December2019Shares(continued)UnitedStates(continued)HasbroInc.USD015,38515,3850HawaiianElectricIndustriesUSD043,96843,9680HCAHealthcareInc.USD01,447,3671,366,82980,538HDSupplyHoldingsInc.USD97,173193,035264,70725,501HealthcareTrustofAmericaInc.-A-USD0223,675223,6750HealthStreamInc.USD0138,027138,0270HeicoCorp.-A-USD065,09965,0990Heidrick&StrugglesInternationalInc.USD072,00072,0000Helmerich&PayneUSD03,1193,1190HeritageCommerceCorp.USD0326,3340326,334HermanMillerInc.USD73,194281,861355,0550HersheyCo.USD0476,462476,4620HessCorp.USD080,65680,6560HexcelCorp.USD0186,447186,4470HighwoodsPropertiesInc.USD081,13181,1310HillenbrandInc.USD0347,712347,7120HiltonGrandVacationsInc.USD172,9060172,9060HiltonWorldwideHoldingsInc.USD0644,189644,1890HMSHoldingsCorp.USD542,1900542,1900HollyfrontierCorp.USD0191,375191,3750HologicInc.USD034,8063,57231,234HomeDepotInc.USD80,509960,742735,893305,358HomeStreetInc.USD0148,7080148,708HoneywellInternationalInc.USD364,948191,926556,8740HormelFoodsCorp.USD040,53840,5380HospitalityPropertiesTrustUSD019,07419,0740HostessBrandsInc.USD02,121,3032,119,1562,147HPInc.USD36,907036,9070HubbellInc.USD05,6585,6580HudsonPacificPropertiesInc.USD074,81174,8110HumanaInc.USD0434,027434,0270HuntingtonIngallsIndustriesUSD012,26612,2660HyattHotelsCorp.-A-USD0228,598228,5980IACViaInteractiveCorp.USD168,773609,817661,086117,504IberiabankCorp.USD0130,378130,3780IcuMedicalInc.USD040,81240,8120IDACORPInc.USD58,790112,773171,5630IDEXCorp.USD4,47220,18224,6540IDEXXLaboratoriesInc.USD053,80653,8060IllinoisToolWorksUSD098,63898,6380IlluminaInc.USD11,109011,1090IndependentBankGroupInc.USD0258,032258,0320IngevityCorp.USD81642,00042,8160IngredionInc.USD062,74662,7460InnovivaInc.USD119,3412,014,8031,637,396496,748InogenInc.USD68,42754,482122,9090InphiCorp.USD053,58353,5830Xtrackers**InformationforShareholders-unaudited(continued)*ThisisasyntheticETF.**ThisincludessyntheticETFs.470",True
None,51 - 56,https://www1.hkexnews.hk/listedco/listconews/sehk/2020/0407/2020040700410.pdf,"Auditor™sResponsibilitiesfortheAuditoftheConsolidatedFinancialStatements(Continued)Fromthematterscommunicatedwiththosechargedwithgovernance,wedeterminethosemattersthatwereofmostsignificanceintheauditoftheconsolidatedfinancialstatementsofthecurrentperiodandarethereforethekeyauditmatters.Wedescribethesemattersinourauditor™sreportunlesslaworregulationprecludespublicdisclosureaboutthematterorwhen,inextremelyrarecircumstances,wedeterminethatamattershouldnotbecommunicatedinourreportbecausetheadverseconsequencesofdoingsowouldreasonablybeexpectedtooutweighthepublicinterestbenefitsofsuchcommunication.Theengagementpartnerontheauditresultinginthisindependentauditor™sreportisHoChunYu.PricewaterhouseCoopersCertifiedPublicAccountantsHongKong,26March2020INDEPENDENTAUDITOR™SREPORT54HuayiTencentEntertainmentCompanyLimited|AnnualReport2019",True
None,6 - 291,https://www1.hkexnews.hk/listedco/listconews/sehk/2020/0406/2020040601352.pdf,"Dynagreen Environmental Protection Group Co., Ltd.290XV. Documents Available for InspectionDocuments availablefor inspectionThe financial statements signed and sealed by the President, Chief Financial Officer and Chief Accountant of the CompanyDocuments availablefor inspectionThe full text of the annual report signed and sealed by the Chairman of the CompanyDocuments availablefor inspectionThe original copies of all of the documents and announcements of the Company disclosed on the website of the Shanghai Stock Exchange (www.sse.com.cn) and in China Securities Journal, Shanghai Securities News, Securities Daily and Securities Times during the Reporting Period.Chairman: ZHI JunDate of submission approved by the Board: 27 March 2020Amendments Applicable  Not applicable",True
None,18 - 191,https://www1.hkexnews.hk/listedco/listconews/sehk/2020/0402/2020040202312.pdf,Annual Report 2019HKElectricInvestmentsandHKElectricInvestmentsLimitedAnnualReport2019,True
None,97 - 102,https://www1.hkexnews.hk/listedco/listconews/sehk/2020/0402/2020040201791.pdf,"INDEPENDENT AUDITOR™S REPORT102ANNUAL REPORTIGG INCAUDITOR™S RESPONSIBILITIES FOR THE AUDIT OF THE CONSOLIDATED FINANCIAL STATEMENTS (Continued)• Evaluate the overall presentation, structure and content of the consolidated financial statements, including  nancial statements represent the underlying transactions and events in a manner that achieves fair presentation.• Obtain sufficient appropriate audit evidence regarding the financial information of the entities or business  nancial statements. We are responsible for the direction, supervision and performance of the Group audit. We remain solely responsible for our audit opinion.We communicate with the Audit Committee regarding, among other matters, the planned scope and timing of the     ciencies in internal control that we identify during our audit.We also provide the Audit Committee with a statement that we have complied with relevant ethical requirements regarding independence and communicate with them all relationships and other matters that may reasonably be thought to bear on our independence and, where applicable, related safeguards.From the matters communicated with the Audit Committee, we determine those matters that were of most   nancial statements of the current period and are therefore the key audit matters. We describe these matters in our auditor’s report unless law or regulation precludes public disclosure about the matter or when, in extremely rare circumstances, we determine that a matter should not be communicated in our report because the adverse consequences of doing so would reasonably be expected to outweigh the public interest  ts of such communication.The engagement partner on the audit resulting in this independent auditor’s report is Liu Hin Pan.KPMG ed Public Accountants8th Floor, Prince’s Building10 Chater RoadCentral, Hong Kong4 March 2020",True
None,218 - 219,https://www1.hkexnews.hk/listedco/listconews/sehk/2020/0402/2020040201526.pdf,"241Basis of our workWe conducted our work in accordance with the International Standard on Assurance Engagements (ISAE) 3000 Assurance Engagements other than Audits or Reviews of Historical Financial Information and ISAE 3410 Assurance Engagements on Greenhouse Gas Statements. These standards require the assurance team to possess the appropriate knowledge, skills and professional competencies needed to perform the assurance engagement.Our independence and quality controlThe firm applies International Standard on Quality Control 1 and accordingly maintains a comprehensive system of quality control including documented policies and procedures regarding compliance with ethical requirements, professional standards and applicable legal and regulatory requirements. We have complied with the independence and other requirements of the Code of Ethics for Professional Accountants issued by the International Ethics Standards Board for Accountants, which is founded on the fundamental principles of integrity, objectivity, professional competence and due care, confidentiality and professional behaviour.Work performedOur limited assurance engagement on the Identified Elements of the Report consists of making inquiries, primarily of persons responsible for the preparation of Identified Elements presented in the Corporate Responsibility and Sustainability Report, and applying analytical and other evidence gathering procedures, as appropriate. These procedures include: Conducting interviews with management and staff responsible for the collection and review of Identified Elements at HSH Head Office to obtain an understanding of the information collection process; Attending a site visit to understand the data collection processes used to gather and review Identified Elements included in the Report; Examining and evaluating the systems and processes in place to generate, aggregate and report the Identified Elements; Agreeing the Identified Elements, on a sample basis, to underlying calculations and supporting schedules; Performing an analytical review of data provided by each operation and investigating, through discussion with management, key movements compared to prior year, expectations and targets; Comparing the definitions as included in the HKEX ESG Guide against the definitions used by HSH to prepare the metrics; Reading the Sustainability Reporting Content Index on pages 38 to 46 to determine whether it is in line with our understanding of HKEX ESG Guide; Reading the information presented in the Report to determine whether it is in line with our overall knowledge of the sustainability performance of HSH.ConclusionBased on the limited assurance procedures and the evidence obtained, nothing has come to our attention that causes us to believe that the Identified Elements, as described above, of the Corporate Responsibility and Sustainability Report and Data Statements 2019 of HSH for the year ended 31 December 2019, are not prepared, in all material respects, in accordance with the Reporting Criteria.KPMG 8th Floor, Prince™s Building 10 Chater Road Central, Hong Kong 17 March 2020",True
